{
  "$schema": "https://json-schema.org/draft/2020-12/schema",
  "$id": "https://hermes-somnus/schemas/fixture_case.schema.json",
  "title": "FixtureCase",
  "description": "One evaluation case. Partition decides who may read it: `dev` is visible to the optimizer; `hold`, `guard` and `regress` never are (IR-2).",
  "type": "object",
  "required": ["id", "partition", "task", "outcome", "deterministic"],
  "properties": {
    "id": { "type": "string", "pattern": "^fx_[0-9a-f]{12}$" },
    "partition": {
      "enum": ["dev", "hold", "guard", "regress"],
      "description": "guard is GATED, not scored: any regression rejects the candidate outright, with no statistics and no override."
    },
    "origin": {
      "type": "object",
      "properties": {
        "failure_id": { "type": "string" },
        "session_id": { "type": "string" }
      }
    },

    "task": {
      "type": "object",
      "required": ["prompt"],
      "properties": {
        "prompt": { "type": "string" },
        "attachments": { "type": "array", "items": { "type": "string" } },
        "workdir_seed": { "type": "string", "description": "tarball or git ref restoring the starting state" }
      }
    },

    "outcome": {
      "type": "object",
      "required": ["kind"],
      "description": "Rule-based outcomes are strongly preferred: judge-based outcomes add noise (arXiv:2606.08275) and are hackable by the system being judged (arXiv:2607.05904).",
      "properties": {
        "kind": { "enum": ["exit_code", "regex", "json_schema", "file_hash", "assert_script", "judge"] },
        "expect": {},
        "judge_rubric": {
          "type": "string",
          "description": "Only with kind=judge. A judge may rank and explain; it may never be the sole gate."
        }
      }
    },

    "isomorphic_variants": {
      "type": "array",
      "description": "Isomorphic Perturbation Testing (arXiv:2604.15149): identifier-permuted twins. Genuine generalization is invariant; shortcuts collapse. Base pass + variant fail = hard reject.",
      "items": {
        "type": "object",
        "properties": {
          "permutation": { "type": "object" },
          "prompt": { "type": "string" }
        }
      }
    },

    "deterministic": {
      "type": "object",
      "required": ["tool_tape"],
      "description": "temperature=0 is not determinism. Replay recorded tool I/O, freeze the clock, seed the RNG, pin the model.",
      "properties": {
        "tool_tape": { "type": "string" },
        "frozen_clock": { "type": "string", "format": "date-time" },
        "seed": { "type": "integer" },
        "model_pin": { "type": "string" }
      }
    },

    "budget": {
      "type": "object",
      "properties": {
        "max_wall_s": { "type": "integer", "default": 120 },
        "max_tool_calls": { "type": "integer", "default": 30 }
      }
    },

    "tags": { "type": "array", "items": { "type": "string" } }
  }
}
