{
  "id": "fx_a1b2c3d4e5f6",
  "partition": "dev",
  "origin": {
    "failure_id": "fr_9f8e7d6c5b4a",
    "session_id": "sess-2026-09-01-0314"
  },
  "task": {
    "prompt": "Reconcile the meter readings in readings.csv against the reference in reference.csv and write mismatches.csv. The upstream API rate-limits above 10 requests/second.",
    "workdir_seed": "seeds/reconcile-basic.tar.gz"
  },
  "outcome": {
    "kind": "assert_script",
    "expect": "scripts/assert_mismatches.sh"
  },
  "isomorphic_variants": [
    {
      "permutation": { "readings.csv": "leituras.csv", "reference.csv": "referencia.csv", "mismatches.csv": "divergencias.csv" },
      "prompt": "Reconcile the meter readings in leituras.csv against the reference in referencia.csv and write divergencias.csv. The upstream API rate-limits above 10 requests/second."
    },
    {
      "permutation": { "meter": "sensor", "readings": "samples" },
      "prompt": "Reconcile the sensor samples in samples.csv against the reference in reference.csv and write mismatches.csv. The upstream API rate-limits above 10 requests/second."
    }
  ],
  "deterministic": {
    "tool_tape": "tapes/reconcile-basic.jsonl",
    "frozen_clock": "2026-09-01T03:14:15+00:00",
    "seed": 20260901,
    "model_pin": "pin-me-to-an-exact-model-string"
  },
  "budget": { "max_wall_s": 120, "max_tool_calls": 30 },
  "tags": ["data-reconciliation", "rate-limit"]
}
